{
  "contract": "layer-snapshot",
  "contract_version": "1.0.0",
  "snapshot_id": "fixture-rosario-2026-06-09",
  "generated_at": "2026-06-09T22:00:00Z",
  "mode": "fixture",
  "disclaimer": "Sample fixture data for local development. Values are synthetic and deterministic. This is NOT live data.",
  "region": {
    "name": "Rosario / Gran Rosario / Paraná corridor / Villa Constitución",
    "bbox": [
      -60.95,
      -33.35,
      -60.2,
      -32.55
    ]
  },
  "time_range": {
    "start": "2026-06-09T00:00:00Z",
    "end": "2026-06-09T21:00:00Z",
    "step_minutes": 180
  },
  "layers": {
    "weather": {
      "id": "weather",
      "label": "Weather",
      "kind": "timeseries",
      "source_id": "open-meteo",
      "status": "ok",
      "last_updated": "2026-06-09T21:05:00Z",
      "features": [
        {
          "id": "wx-rosario-centro",
          "name": "Rosario Centro",
          "lon": -60.6393,
          "lat": -32.9468,
          "observations": [
            {
              "observed_at": "2026-06-09T00:00:00Z",
              "values": {
                "temperature_c": 7,
                "relative_humidity_pct": 97,
                "wind_speed_kmh": 12.6,
                "wind_direction_deg": 185,
                "precipitation_mm": 0
              }
            },
            {
              "observed_at": "2026-06-09T03:00:00Z",
              "values": {
                "temperature_c": 6.8,
                "relative_humidity_pct": 98,
                "wind_speed_kmh": 18,
                "wind_direction_deg": 154,
                "precipitation_mm": 0
              }
            },
            {
              "observed_at": "2026-06-09T06:00:00Z",
              "values": {
                "temperature_c": 5.8,
                "relative_humidity_pct": 104,
                "wind_speed_kmh": 22,
                "wind_direction_deg": 166,
                "precipitation_mm": 0
              }
            },
            {
              "observed_at": "2026-06-09T09:00:00Z",
              "values": {
                "temperature_c": 9.6,
                "relative_humidity_pct": 89,
                "wind_speed_kmh": 13.3,
                "wind_direction_deg": 215,
                "precipitation_mm": 0
              }
            },
            {
              "observed_at": "2026-06-09T12:00:00Z",
              "values": {
                "temperature_c": 13.7,
                "relative_humidity_pct": 69,
                "wind_speed_kmh": 9.2,
                "wind_direction_deg": 151,
                "precipitation_mm": 0
              }
            },
            {
              "observed_at": "2026-06-09T15:00:00Z",
              "values": {
                "temperature_c": 15.7,
                "relative_humidity_pct": 63,
                "wind_speed_kmh": 17.9,
                "wind_direction_deg": 200,
                "precipitation_mm": 0
              }
            },
            {
              "observed_at": "2026-06-09T18:00:00Z",
              "values": {
                "temperature_c": 13.5,
                "relative_humidity_pct": 73,
                "wind_speed_kmh": 19.9,
                "wind_direction_deg": 212,
                "precipitation_mm": 0
              }
            },
            {
              "observed_at": "2026-06-09T21:00:00Z",
              "values": {
                "temperature_c": 10,
                "relative_humidity_pct": 82,
                "wind_speed_kmh": 14.5,
                "wind_direction_deg": 162,
                "precipitation_mm": 0
              }
            }
          ]
        },
        {
          "id": "wx-san-lorenzo",
          "name": "San Lorenzo",
          "lon": -60.7333,
          "lat": -32.7459,
          "observations": [
            {
              "observed_at": "2026-06-09T00:00:00Z",
              "values": {
                "temperature_c": 6.6,
                "relative_humidity_pct": 98,
                "wind_speed_kmh": 11.2,
                "wind_direction_deg": 173,
                "precipitation_mm": 0
              }
            },
            {
              "observed_at": "2026-06-09T03:00:00Z",
              "values": {
                "temperature_c": 6.1,
                "relative_humidity_pct": 99,
                "wind_speed_kmh": 19.8,
                "wind_direction_deg": 204,
                "precipitation_mm": 0
              }
            },
            {
              "observed_at": "2026-06-09T06:00:00Z",
              "values": {
                "temperature_c": 5.4,
                "relative_humidity_pct": 101,
                "wind_speed_kmh": 14.5,
                "wind_direction_deg": 192,
                "precipitation_mm": 0
              }
            },
            {
              "observed_at": "2026-06-09T09:00:00Z",
              "values": {
                "temperature_c": 8.9,
                "relative_humidity_pct": 91,
                "wind_speed_kmh": 9.2,
                "wind_direction_deg": 143,
                "precipitation_mm": 0
              }
            },
            {
              "observed_at": "2026-06-09T12:00:00Z",
              "values": {
                "temperature_c": 13.2,
                "relative_humidity_pct": 70,
                "wind_speed_kmh": 21.1,
                "wind_direction_deg": 219,
                "precipitation_mm": 0
              }
            },
            {
              "observed_at": "2026-06-09T15:00:00Z",
              "values": {
                "temperature_c": 16.1,
                "relative_humidity_pct": 62,
                "wind_speed_kmh": 12.5,
                "wind_direction_deg": 169,
                "precipitation_mm": 0
              }
            },
            {
              "observed_at": "2026-06-09T18:00:00Z",
              "values": {
                "temperature_c": 13,
                "relative_humidity_pct": 70,
                "wind_speed_kmh": 10.5,
                "wind_direction_deg": 150,
                "precipitation_mm": 0
              }
            },
            {
              "observed_at": "2026-06-09T21:00:00Z",
              "values": {
                "temperature_c": 9.2,
                "relative_humidity_pct": 84,
                "wind_speed_kmh": 15.8,
                "wind_direction_deg": 200,
                "precipitation_mm": 0
              }
            }
          ]
        },
        {
          "id": "wx-granadero-baigorria",
          "name": "Granadero Baigorria",
          "lon": -60.6794,
          "lat": -32.8569,
          "observations": [
            {
              "observed_at": "2026-06-09T00:00:00Z",
              "values": {
                "temperature_c": 7.2,
                "relative_humidity_pct": 96,
                "wind_speed_kmh": 13.9,
                "wind_direction_deg": 178,
                "precipitation_mm": 0
              }
            },
            {
              "observed_at": "2026-06-09T03:00:00Z",
              "values": {
                "temperature_c": 6.7,
                "relative_humidity_pct": 97,
                "wind_speed_kmh": 8.5,
                "wind_direction_deg": 208,
                "precipitation_mm": 0
              }
            },
            {
              "observed_at": "2026-06-09T06:00:00Z",
              "values": {
                "temperature_c": 5.4,
                "relative_humidity_pct": 103,
                "wind_speed_kmh": 9.9,
                "wind_direction_deg": 159,
                "precipitation_mm": 0
              }
            },
            {
              "observed_at": "2026-06-09T09:00:00Z",
              "values": {
                "temperature_c": 8.9,
                "relative_humidity_pct": 87,
                "wind_speed_kmh": 18.5,
                "wind_direction_deg": 189,
                "precipitation_mm": 0
              }
            },
            {
              "observed_at": "2026-06-09T12:00:00Z",
              "values": {
                "temperature_c": 13.9,
                "relative_humidity_pct": 68,
                "wind_speed_kmh": 21.3,
                "wind_direction_deg": 220,
                "precipitation_mm": 0
              }
            },
            {
              "observed_at": "2026-06-09T15:00:00Z",
              "values": {
                "temperature_c": 15.6,
                "relative_humidity_pct": 61,
                "wind_speed_kmh": 12.6,
                "wind_direction_deg": 170,
                "precipitation_mm": 0
              }
            },
            {
              "observed_at": "2026-06-09T18:00:00Z",
              "values": {
                "temperature_c": 13.1,
                "relative_humidity_pct": 72,
                "wind_speed_kmh": 18,
                "wind_direction_deg": 151,
                "precipitation_mm": 0
              }
            },
            {
              "observed_at": "2026-06-09T21:00:00Z",
              "values": {
                "temperature_c": 9.3,
                "relative_humidity_pct": 86,
                "wind_speed_kmh": 9.3,
                "wind_direction_deg": 201,
                "precipitation_mm": 0
              }
            }
          ]
        },
        {
          "id": "wx-villa-g-galvez",
          "name": "Villa Gobernador Gálvez",
          "lon": -60.6044,
          "lat": -33.0256,
          "observations": [
            {
              "observed_at": "2026-06-09T00:00:00Z",
              "values": {
                "temperature_c": 7.7,
                "relative_humidity_pct": 94,
                "wind_speed_kmh": 8.3,
                "wind_direction_deg": 146,
                "precipitation_mm": 0
              }
            },
            {
              "observed_at": "2026-06-09T03:00:00Z",
              "values": {
                "temperature_c": 6,
                "relative_humidity_pct": 96,
                "wind_speed_kmh": 16.9,